{
  "schema_version": "18.0",
  "project_id": "02-afro-cuban-house-c-minor-124",
  "session_policy": "discover-current-session",
  "actions": [
    {
      "request_id": "req-0001",
      "depends_on": [],
      "requires_capability": "ensure_track",
      "target": {
        "kind": "track",
        "track_signature": "KICK",
        "clip_signature": null,
        "device_signature": null,
        "parameter_signature": null
      },
      "operation": {
        "type": "ensure_track",
        "payload": {
          "kind": "midi"
        }
      },
      "postconditions": [
        "track_resolved_or_created"
      ],
      "rollback": {},
      "risk": "low"
    },
    {
      "request_id": "req-0002",
      "depends_on": [
        "req-0001"
      ],
      "requires_capability": "create_clip",
      "target": {
        "kind": "clip",
        "track_signature": "KICK",
        "clip_signature": "02-afro-cuban-house-c-minor-124_kick",
        "device_signature": null,
        "parameter_signature": null
      },
      "operation": {
        "type": "create_clip",
        "payload": {
          "start_beat": 0,
          "length_beats": 8.0
        }
      },
      "postconditions": [
        "clip_exists_with_length"
      ],
      "rollback": {
        "type": "restore_snapshot"
      },
      "risk": "low"
    },
    {
      "request_id": "req-0003",
      "depends_on": [
        "req-0002"
      ],
      "requires_capability": "write_notes",
      "target": {
        "kind": "clip",
        "track_signature": "KICK",
        "clip_signature": "02-afro-cuban-house-c-minor-124_kick",
        "device_signature": null,
        "parameter_signature": null
      },
      "operation": {
        "type": "replace_notes",
        "payload": {
          "notes": [
            {
              "pitch": 36,
              "start_beat": 0.0,
              "duration_beats": 0.11,
              "velocity": 114
            },
            {
              "pitch": 36,
              "start_beat": 1.0,
              "duration_beats": 0.11,
              "velocity": 114
            },
            {
              "pitch": 36,
              "start_beat": 2.0,
              "duration_beats": 0.11,
              "velocity": 114
            },
            {
              "pitch": 36,
              "start_beat": 3.0,
              "duration_beats": 0.11,
              "velocity": 114
            },
            {
              "pitch": 36,
              "start_beat": 4.0,
              "duration_beats": 0.11,
              "velocity": 114
            },
            {
              "pitch": 36,
              "start_beat": 5.0,
              "duration_beats": 0.11,
              "velocity": 114
            },
            {
              "pitch": 36,
              "start_beat": 6.0,
              "duration_beats": 0.11,
              "velocity": 114
            },
            {
              "pitch": 36,
              "start_beat": 7.0,
              "duration_beats": 0.11,
              "velocity": 114
            }
          ]
        }
      },
      "postconditions": [
        "roundtrip_notes_equal"
      ],
      "rollback": {
        "type": "restore_snapshot"
      },
      "risk": "medium"
    },
    {
      "request_id": "req-0004",
      "depends_on": [],
      "requires_capability": "ensure_track",
      "target": {
        "kind": "track",
        "track_signature": "CLAVE_GUIDE",
        "clip_signature": null,
        "device_signature": null,
        "parameter_signature": null
      },
      "operation": {
        "type": "ensure_track",
        "payload": {
          "kind": "midi"
        }
      },
      "postconditions": [
        "track_resolved_or_created"
      ],
      "rollback": {},
      "risk": "low"
    },
    {
      "request_id": "req-0005",
      "depends_on": [
        "req-0004"
      ],
      "requires_capability": "create_clip",
      "target": {
        "kind": "clip",
        "track_signature": "CLAVE_GUIDE",
        "clip_signature": "02-afro-cuban-house-c-minor-124_clave",
        "device_signature": null,
        "parameter_signature": null
      },
      "operation": {
        "type": "create_clip",
        "payload": {
          "start_beat": 0,
          "length_beats": 8.0
        }
      },
      "postconditions": [
        "clip_exists_with_length"
      ],
      "rollback": {
        "type": "restore_snapshot"
      },
      "risk": "low"
    },
    {
      "request_id": "req-0006",
      "depends_on": [
        "req-0005"
      ],
      "requires_capability": "write_notes",
      "target": {
        "kind": "clip",
        "track_signature": "CLAVE_GUIDE",
        "clip_signature": "02-afro-cuban-house-c-minor-124_clave",
        "device_signature": null,
        "parameter_signature": null
      },
      "operation": {
        "type": "replace_notes",
        "payload": {
          "notes": [
            {
              "pitch": 37,
              "start_beat": 0.0,
              "duration_beats": 0.1,
              "velocity": 100
            },
            {
              "pitch": 37,
              "start_beat": 1.5,
              "duration_beats": 0.1,
              "velocity": 96
            },
            {
              "pitch": 37,
              "start_beat": 3.0,
              "duration_beats": 0.1,
              "velocity": 103
            },
            {
              "pitch": 37,
              "start_beat": 5.0,
              "duration_beats": 0.1,
              "velocity": 98
            },
            {
              "pitch": 37,
              "start_beat": 6.0,
              "duration_beats": 0.1,
              "velocity": 102
            }
          ]
        }
      },
      "postconditions": [
        "roundtrip_notes_equal"
      ],
      "rollback": {
        "type": "restore_snapshot"
      },
      "risk": "medium"
    },
    {
      "request_id": "req-0007",
      "depends_on": [],
      "requires_capability": "ensure_track",
      "target": {
        "kind": "track",
        "track_signature": "CONGA_ROLE",
        "clip_signature": null,
        "device_signature": null,
        "parameter_signature": null
      },
      "operation": {
        "type": "ensure_track",
        "payload": {
          "kind": "midi"
        }
      },
      "postconditions": [
        "track_resolved_or_created"
      ],
      "rollback": {},
      "risk": "low"
    },
    {
      "request_id": "req-0008",
      "depends_on": [
        "req-0007"
      ],
      "requires_capability": "create_clip",
      "target": {
        "kind": "clip",
        "track_signature": "CONGA_ROLE",
        "clip_signature": "02-afro-cuban-house-c-minor-124_conga",
        "device_signature": null,
        "parameter_signature": null
      },
      "operation": {
        "type": "create_clip",
        "payload": {
          "start_beat": 0,
          "length_beats": 8.0
        }
      },
      "postconditions": [
        "clip_exists_with_length"
      ],
      "rollback": {
        "type": "restore_snapshot"
      },
      "risk": "low"
    },
    {
      "request_id": "req-0009",
      "depends_on": [
        "req-0008"
      ],
      "requires_capability": "write_notes",
      "target": {
        "kind": "clip",
        "track_signature": "CONGA_ROLE",
        "clip_signature": "02-afro-cuban-house-c-minor-124_conga",
        "device_signature": null,
        "parameter_signature": null
      },
      "operation": {
        "type": "replace_notes",
        "payload": {
          "notes": [
            {
              "pitch": 64,
              "start_beat": 0.75,
              "duration_beats": 0.1,
              "velocity": 88
            },
            {
              "pitch": 64,
              "start_beat": 2.5,
              "duration_beats": 0.1,
              "velocity": 98
            },
            {
              "pitch": 64,
              "start_beat": 3.75,
              "duration_beats": 0.1,
              "velocity": 84
            },
            {
              "pitch": 64,
              "start_beat": 4.5,
              "duration_beats": 0.1,
              "velocity": 90
            },
            {
              "pitch": 64,
              "start_beat": 6.75,
              "duration_beats": 0.1,
              "velocity": 100
            }
          ]
        }
      },
      "postconditions": [
        "roundtrip_notes_equal"
      ],
      "rollback": {
        "type": "restore_snapshot"
      },
      "risk": "medium"
    },
    {
      "request_id": "req-0010",
      "depends_on": [],
      "requires_capability": "ensure_track",
      "target": {
        "kind": "track",
        "track_signature": "SHAKER",
        "clip_signature": null,
        "device_signature": null,
        "parameter_signature": null
      },
      "operation": {
        "type": "ensure_track",
        "payload": {
          "kind": "midi"
        }
      },
      "postconditions": [
        "track_resolved_or_created"
      ],
      "rollback": {},
      "risk": "low"
    },
    {
      "request_id": "req-0011",
      "depends_on": [
        "req-0010"
      ],
      "requires_capability": "create_clip",
      "target": {
        "kind": "clip",
        "track_signature": "SHAKER",
        "clip_signature": "02-afro-cuban-house-c-minor-124_shaker",
        "device_signature": null,
        "parameter_signature": null
      },
      "operation": {
        "type": "create_clip",
        "payload": {
          "start_beat": 0,
          "length_beats": 8.0
        }
      },
      "postconditions": [
        "clip_exists_with_length"
      ],
      "rollback": {
        "type": "restore_snapshot"
      },
      "risk": "low"
    },
    {
      "request_id": "req-0012",
      "depends_on": [
        "req-0011"
      ],
      "requires_capability": "write_notes",
      "target": {
        "kind": "clip",
        "track_signature": "SHAKER",
        "clip_signature": "02-afro-cuban-house-c-minor-124_shaker",